"id","title","genre","overview","poster_path","vote_average"
157336,"Interstellar","Adventure, Drama, Sci-Fi","The adventures of a group of explorers who make use of a newly discovered wormhole to surpass the limitations on human space travel and conquer the vast distances involved in an interstellar voyage.","https://image.tmdb.org/t/p/w500/gEU2QniE6E77NI6lCU6MvrIdfi1.jpg",8.4
155,"The Dark Knight","Action, Crime, Drama","Batman raises the stakes in his war on crime. With the help of Lt. Jim Gordon and District Attorney Harvey Dent, Batman sets out to dismantle the remaining criminal organizations that plague the streets.","https://image.tmdb.org/t/p/w500/qJ2tW6WMOTnwQSBi98FlMACiZ2j.jpg",8.5
27205,"Inception","Action, Sci-Fi, Adventure","Cobb, a skilled thief who specializes in the secret art of inception, must plant an idea into a CEO's mind in exchange for his criminal record being wiped.","https://image.tmdb.org/t/p/w500/oYuLEt3zVCKq57qu2F8dT7NIa6f.jpg",8.4
299534,"Avengers: Endgame","Action, Adventure, Sci-Fi","After the devastating events of Infinity War, the universe is in ruins. With the help of remaining allies, the Avengers assemble once more.","https://image.tmdb.org/t/p/w500/or06FN3Dka5tukK1e9sl16pB3iy.jpg",8.3
603,"The Matrix","Action, Sci-Fi","Set in the 22nd century, The Matrix tells the story of a computer hacker who joins a group of underground insurgents fighting the vast and powerful computers who now rule the earth.","https://image.tmdb.org/t/p/w500/f89U3ADr1oiB1s9GkdPOEpXUk5H.jpg",8.2
597,"Titanic","Drama, Romance","101-year-old Rose DeWitt Bukater tells the story of her life aboard the Titanic, 84 years later.","https://image.tmdb.org/t/p/w500/9xjZS2rlVxm8SFx8kPC3aIGCOYQ.jpg",7.9
475557,"Joker","Crime, Thriller, Drama","During the 1980s, a failed stand-up comedian is driven insane and turns to a life of crime and chaos in Gotham City while becoming an infamous psychopathic crime figure.","https://image.tmdb.org/t/p/w500/udDclJoHjfpt8QmlCGZHhFUvGfQ.jpg",8.2
19995,"Avatar","Action, Adventure, Fantasy","In the 22nd century, a paraplegic Marine is dispatched to the moon Pandora on a unique mission, but becomes torn between following orders and protecting a new world.","https://image.tmdb.org/t/p/w500/kyeqWdyA2x15MffH41YwI19e2qH.jpg",7.6
634649,"Spider-Man: No Way Home","Action, Adventure, Fantasy","Peter Parker is unmasked and no longer able to separate his normal life from the high-stakes of being a super-hero. When he asks for help from Doctor Strange, the stakes become even more dangerous.","https://image.tmdb.org/t/p/w500/1g0dhYtq4irTY1Rto0br921P540.jpg",8.0
313369,"La La Land","Comedy, Drama, Music","Mia, an aspiring actress, and Sebastian, a dedicated jazz musician, are struggling to make ends meet in a city known for crushing hopes and breaking hearts.","https://image.tmdb.org/t/p/w500/uDO8zWDhfWkA10F11M080T2K2U8.jpg",7.9
238,"The Godfather","Drama, Crime","Spanning the years 1945 to 1955, a chronicle of the fictional Italian-American Corleone crime family. When organized crime family patriarch, Vito Corleone barely survives an attempt on his life, his youngest son, Michael steps in to take care of the would-be killers.","https://image.tmdb.org/t/p/w500/3bhkrj0eFSt8lD2W2f7vB02wB1T.jpg",8.7
680,"Pulp Fiction","Thriller, Crime","A burger-loving hit man, his philosophical partner, a drug-addled gangster's moll and a washed-up boxer converge in this sprawling, comedic crime caper.","https://image.tmdb.org/t/p/w500/d5iIlFn5s0IesR1L3B5hBZbkSBB.jpg",8.5
550,"Fight Club","Drama","A ticking-time-bomb insomniac and a slippery soap salesman channel primal male aggression into a shocking new form of therapy.","https://image.tmdb.org/t/p/w500/pB8BM7pdSp6B6Ih7QZ4DrQ3PmJK.jpg",8.4
13,"Forrest Gump","Comedy, Drama, Romance","A man with a low IQ has accomplished great things in his life and been present during significant historic events—in each case, far exceeding what anyone imagined he could do.","https://image.tmdb.org/t/p/w500/arw2vGzB04c8fA9Z1D0oYj1LDBx.jpg",8.5
278,"The Shawshank Redemption","Drama","Framed in the 1940s for the double murder of his wife and her lover, upstanding banker Andy Dufresne begins a new life at the Shawshank prison.","https://image.tmdb.org/t/p/w500/9O7gLzmreU0nGkIB1u0a07Kht1x.jpg",8.7
122,"The Lord of the Rings: The Return of the King","Adventure, Fantasy, Action","Aragorn is revealed as the heir to the ancient kings as he, Gandalf and the other members of the broken fellowship struggle to save Gondor from Sauron's forces.","https://image.tmdb.org/t/p/w500/rCzpDGLbOoPwLjy3OAm5NUPOTr2.jpg",8.5
1891,"The Empire Strikes Back","Adventure, Action, Sci-Fi","The epic saga continues as Luke Skywalker, in hopes of defeating the evil Galactic Empire, learns the ways of the Jedi from aging master Yoda.","https://image.tmdb.org/t/p/w500/2l05cFWJiqVDsL8v42c9k1n9jEE.jpg",8.4
98,"Gladiator","Action, Drama, Adventure","In the year 180, the death of emperor Marcus Aurelius throws the Roman Empire into chaos. Maximus is one of the Roman army's most capable and trusted generals.","https://image.tmdb.org/t/p/w500/t7D10d8TnmAx4EkiB479hVNT2hS.jpg",8.2
12,"Finding Nemo","Animation, Family","Nemo, an adventurous young clownfish, is unexpectedly taken from his Great Barrier Reef home to a dentist's office aquarium.","https://image.tmdb.org/t/p/w500/ggQIPy6oIx08CHLfdexd3Kg3enD.jpg",7.8
105,"Back to the Future","Adventure, Comedy, Sci-Fi","Eighties teenager Marty McFly is accidentally sent back in time to 1955, inadvertently interfering with his parents' budding romance and risking his own existence.","https://image.tmdb.org/t/p/w500/fNOH9f1aA7XPRW0EQqG48nJg3Fq.jpg",8.3
274,"The Silence of the Lambs","Crime, Drama, Horror","FBI trainee Clarice Starling ventures into a maximum-security asylum to interview the infamous Dr. Hannibal Lecter, a psychiatrist-turned-cannibal, to help capture a serial killer.","https://image.tmdb.org/t/p/w500/rS8fHnS6p74UiyBQK1aonn9HQC6.jpg",8.5
497,"The Green Mile","Fantasy, Drama, Crime","Death Row guards at a penitentiary, in the 1930s, have a moral dilemma with their job when they discover one of their prisoners, a convicted murderer, has a special gift.","https://image.tmdb.org/t/p/w500/808hf4Yp6Zp67S9Yp0vNfNpPj4S.jpg",8.5
157,"Star Trek II: The Wrath of Khan","Action, Adventure, Sci-Fi","Admiral James T. Kirk and the crew of the USS Enterprise face off against the genetically-engineered tyrant Khan Noonien Singh, who has escaped exile and seeks revenge.","https://image.tmdb.org/t/p/w500/pYPrc9uDlvWvWw2nU4F1aO8oY0f.jpg",7.7
857,"Saving Private Ryan","Drama, History, War","As US troops storm the beaches of Normandy, three brothers lie dead while a fourth, Private James Ryan, is trapped behind enemy lines. Captain John Miller and seven men set out to find him.","https://image.tmdb.org/t/p/w500/1QvB0w0uPdG8Y8Y0QvB0S1WvO0v.jpg",8.2
120,"The Lord of the Rings: The Fellowship of the Ring","Adventure, Fantasy, Action","Young hobbit Frodo Baggins is tasked with a dangerous journey to destroy a powerful ring that could plunge Middle-earth into darkness.","https://image.tmdb.org/t/p/w500/6oom5QYvAisv8VIiMWHvbo9vYvY.jpg",8.4
121,"The Lord of the Rings: The Two Towers","Adventure, Fantasy, Action","Frodo and Sam continue their journey to Mordor as Aragorn, Legolas, and Gimli defend the kingdom of Rohan from the wizard Saruman's Orc army.","https://image.tmdb.org/t/p/w500/5VTN0S9GWqqtB3S8S0S1WvO0v.jpg",8.4
11,"Star Wars","Adventure, Action, Sci-Fi","Luke Skywalker joins forces with a Jedi Knight, a cocky pilot, a Wookiee and two droids to save the galaxy from the Empire's world-destroying battle station.","https://image.tmdb.org/t/p/w500/6FfWSzuVAisv8VIiMWHvbo9vYvY.jpg",8.2
1892,"Return of the Jedi","Adventure, Action, Sci-Fi","Luke Skywalker leads a mission to rescue Han Solo from Jabba the Hutt before joining the Rebel fleet in an assault on the new Death Star.","https://image.tmdb.org/t/p/w500/m8B9hS9GWqqtB3S8S0S1WvO0v.jpg",7.9
24428,"The Avengers","Action, Adventure, Sci-Fi","Loki, the adoptive brother of Thor, arrives on Earth to conquer it. Nick Fury, director of SHIELD, initiates the Avengers Initiative to stop him.","https://image.tmdb.org/t/p/w500/RYMX2uS6p74UiyBQK1aonn9HQC6.jpg",7.7
24,"Kill Bill: Vol. 1","Action, Crime","An assassin is shot by her ruthless employer, Bill, and other members of their assassination circle on her wedding day. Her unborn child dies. Five years later she awakens from a coma and seeks revenge.","https://image.tmdb.org/t/p/w500/v7TaRYMX2uS6p74UiyBQK1aonn9HQC6.jpg",8.0
25,"Kill Bill: Vol. 2","Action, Crime, Thriller","The Bride continues her quest of vengeance against her former boss and lover Bill, the renegade bouncer Budd, and the treacherous, one-eyed Elle Driver.","https://image.tmdb.org/t/p/w500/2L9yv7TaRYMX2uS6p74UiyBQK1aonn9HQC6.jpg",7.9
807,"Se7en","Crime, Mystery, Thriller","Two detectives, a rookie and a veteran, hunt a serial killer who uses the seven deadly sins as his motifs.","https://image.tmdb.org/t/p/w500/6yog7S8S0S1WvO0vNfNpPj4S.jpg",8.4
101,"Leon: The Professional","Action, Crime, Drama","A professional assassin reluctantly takes in a 12-year-old girl after her family is murdered by corrupt DEA agents.","https://image.tmdb.org/t/p/w500/y66S8S0S1WvO0vNfNpPj4S.jpg",8.3
38,"Eternal Sunshine of the Spotless Mind","Science Fiction, Drama, Romance","When their relationship turns sour, a couple undergoes a medical procedure to have each other erased from their memories.","https://image.tmdb.org/t/p/w500/56yog7S8S0S1WvO0vNfNpPj4S.jpg",8.1
510,"One Flew Over the Cuckoo's Nest","Drama","A criminal pleads insanity and is admitted to a mental institution, where he rallies up the scared patients against the tyrannical Nurse Ratched.","https://image.tmdb.org/t/p/w500/3VRyv7TaRYMX2uS6p74UiyBQK1aonn9HQC6.jpg",8.4
141,"Donnie Darko","Fantasy, Drama, Mystery","A troubled teenager is plagued by visions of a large bunny rabbit that manipulates him to commit a series of crimes, after narrowly escaping a bizarre accident.","https://image.tmdb.org/t/p/w500/v7TaRYMX2uS6p74UiyBQK1aon9HQC6.jpg",7.8
85,"Casablanca","Drama, Romance","In Casablanca, Morocco during World War II, a cynical American expatriate meets a former lover, with unforeseen complications.","https://image.tmdb.org/t/p/w500/hYv8zWDhfWkA10F11M080T2K2U8.jpg",8.2
14,"American Beauty","Drama","A telesales operative becomes disillusioned with his existence and begins to lust after his daughter's best friend.","https://image.tmdb.org/t/p/w500/l6yog7S8S0S1WvO0vNfNpPj4S.jpg",8.0
629,"The Usual Suspects","Drama, Crime, Mystery","A sole survivor tells of the twisty events leading up to a horrific gun battle on a boat, which began when five criminals met at a seemingly random police lineup.","https://image.tmdb.org/t/p/w500/808hf4Yp6Zp67S9Yp0vNfNpPj4S.jpg",8.2
77,"Memento","Mystery, Thriller","A man with short-term memory loss attempts to track down his wife's murderer.","https://image.tmdb.org/t/p/w500/m8B9hS9GWqqtB3S8S0S1WvO0v.jpg",8.2
28,"Apocalypse Now","Drama, War","A U.S. Army officer serving in Vietnam is tasked with assassinating a renegade Special Forces colonel who sees himself as a god.","https://image.tmdb.org/t/p/w500/pPrp6S7p74UiyBQK1aonn9HQC6.jpg",8.3
769,"GoodFellas","Drama, Crime","The story of Henry Hill and his life in the mob, covering his relationship with his wife Karen Hill and his mob partners Jimmy Conway and Tommy DeVito in the Italian-American crime syndicate.","https://image.tmdb.org/t/p/w500/6y7S8S0S1WvO0vNfNpPj4S.jpg",8.5
598,"City of God","Drama, Crime","In the slums of Rio, two kids' paths diverge as one struggles to become a photographer and the other a kingpin.","https://image.tmdb.org/t/p/w500/808hf4Yp6Zp67S9Yp0vNfNpPj4S.jpg",8.4
637,"Life Is Beautiful","Comedy, Drama","A touching story of an Italian bookshop owner who uses his imagination to shield his son from the horrors of internment in a Nazi concentration camp.","https://image.tmdb.org/t/p/w500/m8B9hS9GWqqtB3S8S0S1WvO0v.jpg",8.5
1573,"Die Hard","Action, Thriller","An NYPD officer tries to save his wife and several others taken hostage by German terrorists during a Christmas party at the Nakatomi Plaza in Los Angeles.","https://image.tmdb.org/t/p/w500/pPrp6S7p74UiyBQK1aonn9HQC6.jpg",7.8
1124,"The Prestige","Drama, Mystery, Sci-Fi","After a tragic accident, two stage magicians in 1890s London engage in a battle to create the ultimate illusion while sacrificing everything they have to outwit each other.","https://image.tmdb.org/t/p/w500/808hf4Yp6Zp67S9Yp0vNfNpPj4S.jpg",8.2
11324,"The Departed","Drama, Crime, Thriller","An undercover cop and a mole in the police attempt to identify each other while infiltrating an Irish gang in South Boston.","https://image.tmdb.org/t/p/w500/m8B9hS9GWqqtB3S8S0S1WvO0v.jpg",8.2
12477,"Grave of the Fireflies","Animation, Drama, War","A young boy and his little sister struggle to survive in Japan during World War II.","https://image.tmdb.org/t/p/w500/f89U3ADr1oiB1s9GkdPOEpXUk5H.jpg",8.5
129,"Spirited Away","Animation, Family, Fantasy","A young girl wanders into a world ruled by gods, witches, and spirits, and where humans are changed into beasts.","https://image.tmdb.org/t/p/w500/3bhkrj0eFSt8lD2W2f7vB02wB1T.jpg",8.5
4935,"Howl's Moving Castle","Animation, Fantasy, Romance","When an unconfident young woman is cursed with an old body by a spiteful witch, her only chance of breaking the spell lies with a self-indulgent yet insecure young wizard and his companions in his leggy, walking castle.","https://image.tmdb.org/t/p/w500/6y7S8S0S1WvO0vNfNpPj4S.jpg",8.4
694,"The Shining","Horror, Thriller","Jack Torrance accepts a caretaker job at the Overlook Hotel, where he, along with his wife Wendy and their son Danny, must live through the isolation of the winter. But they are not alone.","https://image.tmdb.org/t/p/w500/xUuHjQgoD3U7vVKA7fKd99S9QBD.jpg",8.2
346364,"It","Horror, Fantasy","In the summer of 1989, a group of bullied kids band together to destroy a shape-shifting monster, which disguises itself as a clown and preys on the children of Derry, Maine.","https://image.tmdb.org/t/p/w500/9E2yLsSsbkyR7v7vVKA7fKd99S9QBD.jpg",7.2
170,"2001: A Space Odyssey","Science Fiction, Adventure","Humanity finds a mysterious object buried beneath the lunar surface and sets off to find its origins with the help of H.A.L. 9000, a sentient supercomputer.","https://image.tmdb.org/t/p/w500/ve72viNPrKmBp68goD3U7vVKA7fKd99S9QBD.jpg",8.1
539,"Psycho","Horror, Thriller, Mystery","When Marion Crane stealing 40,000 dollars from her employer's client, she goes on the run and checks into a remote motel-run by a young man under the domination of his mother.","https://image.tmdb.org/t/p/w500/819yLsSsbkyR7v7vVKA7fKd99S9QBD.jpg",8.4
18,"The Exorcist","Horror","12-year-old Regan MacNeil begins to adapt an explicit, new personality as strange events begin to happen in Georgetown. her mother becomes torn between science and superstition.","https://image.tmdb.org/t/p/w500/9E2yLsSsbkyR7v7vVKA7fKyv9S9QBD.jpg",7.7

